{
  "aadp_version": "1.0",
  "generated_at": "2026-07-25T09:30:00Z",
  "checksum": "sha256:e650ac404d2204450df99b6ecf77f93136f0dbe4ca6758b191b0a5a11d9f1531",
  "sitemaps": [
    {
      "type": "example",
      "url": "https://example.aadp.dev/ai/v1.0/sitemaps/example.json",
      "count": 2
    }
  ]
}
